recommendationid,language,review,translated_en,translated_en_fixed
54655193,english,"A very nice addition to a game that's already good. The new campaign introduces a new setting with new music, unit assets and maps. The campaign is challenging, but not something that's impossible to beat (practice with other, easier campaigns first, if you find it too hard).  I've seen some (fortunately only a few people) going on about ""blabla Muslim favoring blabla"" - seriously? The campaign is inspired by historical events at the time when Saladin engaged in his war after Raynald de Châtillon - a robber baron if there ever was one - had repeatedly broken treaties with Saladin and attacked caravans, provoking war. The game doesn't ""favor"" Saladin anymore than any other campaigns would ""favor"" their respective group (for example, does the Viking campaign ""favor"" Vikings because it depicts events from their perspective?). If anything I find it refreshing to have a campaign from the perspective of Saladin's side.  Help support the developers and increase our chances of getting additional DLC campaigns by buying this.   ","A very nice addition to a game that's already good. The new campaign introduces a new setting with new music, unit assets and maps. The campaign is challenging, but not something that's impossible to beat (practice with other, easier campaigns first, if you find it too hard).  I've seen some (fortunately only a few people) going on about ""blabla Muslim favoring blabla"" - seriously? The campaign is inspired by historical events at the time when Saladin engaged in his war after Raynald de Châtillon - a robber baron if there ever was one - had repeatedly broken treaties with Saladin and attacked caravans, provoking war. The game doesn't ""favor"" Saladin anymore than any other campaigns would ""favor"" their respective group (for example, does the Viking campaign ""favor"" Vikings because it depicts events from their perspective?). If anything I find it refreshing to have a campaign from the perspective of Saladin's side.  Help support the developers and increase our chances of getting additional DLC campaigns by buying this.   ","A very nice addition to a game that's already good. The new campaign introduces a new setting with new music, unit assets and maps. The campaign is challenging, but not something that's impossible to beat (practice with other, easier campaigns first, if you find it too hard).  I've seen some (fortunately only a few people) going on about ""blabla Muslim favoring blabla"" - seriously? The campaign is inspired by historical events at the time when Saladin engaged in his war after Raynald de Chtillon - a robber baron if there ever was one - had repeatedly broken treaties with Saladin and attacked caravans, provoking war. The game doesn't ""favor"" Saladin anymore than any other campaigns would ""favor"" their respective group (for example, does the Viking campaign ""favor"" Vikings because it depicts events from their perspective?). If anything I find it refreshing to have a campaign from the perspective of Saladin's side.  Help support the developers and increase our chances of getting additional DLC campaigns by buying this.   "
71158669,english,"Even as a new release, this game is superior to other zombie survival games that I own.  I have way more zombie games than this, but I’m only including zombie survival games.  I own Project Zomboid, 7 Days to Die, Miscreated, Fort Zombie, State of Decay, and Day Z.  The AI in this game is fantastic.   Zombies track you by visual, smell and sound.  You have wind direction to contend with when sneaking up on zombies.   They’re fast movers. If you take on three at a time you are probably going to take some damage and risk infection.  There’s different classes of zombies too.  White (worst), red, blue and green.  High pucker factor when you’re hiding in a house freezing your butt off and there’s 6 zombies circling it, trying to figure out where you went.    You’ve got great enemy NPC AI.  These guys are bastards.  They’ll Molotov your base and burn down anything made of wood.  They come in mixed sizes and groups.  They’ll retreat if they’re getting clobbered and will sometimes regroup for another attack.  They’ve got guns, Bows and arrows, explosive packs and guns.  They’ll heal themselves if they take damage too.  You can ally with bases and ally with NPCs who will help form and protect your base.  Low morale sometimes happens.  If it does, tell the NPC their services will no longer be needed and then kill them.  But don’t do it in front of the other team members.  They’re smart and they notice this stuff.  Like if they see you skin or eat another human.  That’s something that is frowned upon  but hey, you’ve gotta eat and it’s a great alternative meal source.  You’ve got cold weather to contend with.  Always a decision of insulation vs. protection.  Oh, and the insulation gets wet and then you have to let it dry before you will get warm again with it.  Get ready for hypothermia.  You’ve got skill sets that you work to improve, unless you can find some skill books to carry and help you out.  Major areas needing improvement:  There should be a way to do hotkeys.  That way you’ve got hotkeys for your weapons, food, drink and medicine.    That’s the only major gripe I have because it happens all the time.  You run into a zombie and then are running and trying to scroll wheel to the right weapon to use.  Scrolling through food and water, clicking on a cucumber.  It’s annoying but manageable.    Multiplayer needs some work.  Expect some delays when people jump in and out of your game.  I play single player so it’s no big deal.  Then minor things:  Also a minimap while you travel.  More music scores.  Better sound effects.  More weapons and items.  Way to generate more resources that you use up (iron, flint, stone, trees).    Make it easier to hunt rabbits and have more game to hunt.  More immersion on the dialogues quests with NPCs.  Maybe summers you have to deal with heat if you’re dumb enough to wear your winter gear in the summer.  But provide summer clothes to offset that.   Friendly AI needs to do a better job defending themselves from zombies.  If your AI has high melee skill and good fitness, they should be able to block and own zombies in a one on one fight.   Other thoughts:  Hard to believe this game is being made by one guy named Bob.   This one guy made a game that runs circles around the development “teams” of the other games I listed.   And he’s still updating the game regularly.  Look at the update history.   Support community is great.  You can find them on Discord and they will answer your questions.  This game is super cheap considering the amount of quality content and entertainment it delivers.  If you were naïve enough to buy one of the other zombie games I listed at their asking price based on unfulfilled promises, you owe to yourself to buy this game.  It’s freaking awesome.","Even as a new release, this game is superior to other zombie survival games that I own.  I have way more zombie games than this, but I’m only including zombie survival games.  I own Project Zomboid, 7 Days to Die, Miscreated, Fort Zombie, State of Decay, and Day Z.  The AI in this game is fantastic.   Zombies track you by visual, smell and sound.  You have wind direction to contend with when sneaking up on zombies.   They’re fast movers. If you take on three at a time you are probably going to take some damage and risk infection.  There’s different classes of zombies too.  White (worst), red, blue and green.  High pucker factor when you’re hiding in a house freezing your butt off and there’s 6 zombies circling it, trying to figure out where you went.    You’ve got great enemy NPC AI.  These guys are bastards.  They’ll Molotov your base and burn down anything made of wood.  They come in mixed sizes and groups.  They’ll retreat if they’re getting clobbered and will sometimes regroup for another attack.  They’ve got guns, Bows and arrows, explosive packs and guns.  They’ll heal themselves if they take damage too.  You can ally with bases and ally with NPCs who will help form and protect your base.  Low morale sometimes happens.  If it does, tell the NPC their services will no longer be needed and then kill them.  But don’t do it in front of the other team members.  They’re smart and they notice this stuff.  Like if they see you skin or eat another human.  That’s something that is frowned upon  but hey, you’ve gotta eat and it’s a great alternative meal source.  You’ve got cold weather to contend with.  Always a decision of insulation vs. protection.  Oh, and the insulation gets wet and then you have to let it dry before you will get warm again with it.  Get ready for hypothermia.  You’ve got skill sets that you work to improve, unless you can find some skill books to carry and help you out.  Major areas needing improvement:  There should be a way to do hotkeys.  That way you’ve got hotkeys for your weapons, food, drink and medicine.    That’s the only major gripe I have because it happens all the time.  You run into a zombie and then are running and trying to scroll wheel to the right weapon to use.  Scrolling through food and water, clicking on a cucumber.  It’s annoying but manageable.    Multiplayer needs some work.  Expect some delays when people jump in and out of your game.  I play single player so it’s no big deal.  Then minor things:  Also a minimap while you travel.  More music scores.  Better sound effects.  More weapons and items.  Way to generate more resources that you use up (iron, flint, stone, trees).    Make it easier to hunt rabbits and have more game to hunt.  More immersion on the dialogues quests with NPCs.  Maybe summers you have to deal with heat if you’re dumb enough to wear your winter gear in the summer.  But provide summer clothes to offset that.   Friendly AI needs to do a better job defending themselves from zombies.  If your AI has high melee skill and good fitness, they should be able to block and own zombies in a one on one fight.   Other thoughts:  Hard to believe this game is being made by one guy named Bob.   This one guy made a game that runs circles around the development “teams” of the other games I listed.   And he’s still updating the game regularly.  Look at the update history.   Support community is great.  You can find them on Discord and they will answer your questions.  This game is super cheap considering the amount of quality content and entertainment it delivers.  If you were naïve enough to buy one of the other zombie games I listed at their asking price based on unfulfilled promises, you owe to yourself to buy this game.  It’s freaking awesome.","Even as a new release, this game is superior to other zombie survival games that I own.  I have way more zombie games than this, but Im only including zombie survival games.  I own Project Zomboid, 7 Days to Die, Miscreated, Fort Zombie, State of Decay, and Day Z.  The AI in this game is fantastic.   Zombies track you by visual, smell and sound.  You have wind direction to contend with when sneaking up on zombies.   Theyre fast movers. If you take on three at a time you are probably going to take some damage and risk infection.  Theres different classes of zombies too.  White (worst), red, blue and green.  High pucker factor when youre hiding in a house freezing your butt off and theres 6 zombies circling it, trying to figure out where you went.    Youve got great enemy NPC AI.  These guys are bastards.  Theyll Molotov your base and burn down anything made of wood.  They come in mixed sizes and groups.  Theyll retreat if theyre getting clobbered and will sometimes regroup for another attack.  Theyve got guns, Bows and arrows, explosive packs and guns.  Theyll heal themselves if they take damage too.  You can ally with bases and ally with NPCs who will help form and protect your base.  Low morale sometimes happens.  If it does, tell the NPC their services will no longer be needed and then kill them.  But dont do it in front of the other team members.  Theyre smart and they notice this stuff.  Like if they see you skin or eat another human.  Thats something that is frowned upon  but hey, youve gotta eat and its a great alternative meal source.  Youve got cold weather to contend with.  Always a decision of insulation vs. protection.  Oh, and the insulation gets wet and then you have to let it dry before you will get warm again with it.  Get ready for hypothermia.  Youve got skill sets that you work to improve, unless you can find some skill books to carry and help you out.  Major areas needing improvement:  There should be a way to do hotkeys.  That way youve got hotkeys for your weapons, food, drink and medicine.    Thats the only major gripe I have because it happens all the time.  You run into a zombie and then are running and trying to scroll wheel to the right weapon to use.  Scrolling through food and water, clicking on a cucumber.  Its annoying but manageable.    Multiplayer needs some work.  Expect some delays when people jump in and out of your game.  I play single player so its no big deal.  Then minor things:  Also a minimap while you travel.  More music scores.  Better sound effects.  More weapons and items.  Way to generate more resources that you use up (iron, flint, stone, trees).    Make it easier to hunt rabbits and have more game to hunt.  More immersion on the dialogues quests with NPCs.  Maybe summers you have to deal with heat if youre dumb enough to wear your winter gear in the summer.  But provide summer clothes to offset that.   Friendly AI needs to do a better job defending themselves from zombies.  If your AI has high melee skill and good fitness, they should be able to block and own zombies in a one on one fight.   Other thoughts:  Hard to believe this game is being made by one guy named Bob.   This one guy made a game that runs circles around the development teams of the other games I listed.   And hes still updating the game regularly.  Look at the update history.   Support community is great.  You can find them on Discord and they will answer your questions.  This game is super cheap considering the amount of quality content and entertainment it delivers.  If you were nave enough to buy one of the other zombie games I listed at their asking price based on unfulfilled promises, you owe to yourself to buy this game.  Its freaking awesome."
81921098,schinese,这个游戏得一个人玩，这样子就可以体验到在孤儿院中孩子们的天真烂漫，体验到不同于真实世界的那种他人的温暖。特别是在晚上玩，听和蔼的老师给你讲睡前故事，美滋滋。极其温馨的一款游戏。,"This is a one-person game that allows children to experience the naïve and miserable childhood in an orphanage and the warmth of others that is different from the real world. Especially at night, when the teacher is playing and listening to the music and telling you a bedtime story, a very warm game.","This is a one-person game that allows children to experience the nave and miserable childhood in an orphanage and the warmth of others that is different from the real world. Especially at night, when the teacher is playing and listening to the music and telling you a bedtime story, a very warm game."
