recommendationid,language,review,translated_en,translated_en_fixed
109109141,schinese,以前的我一向是看不起虚拟主播的 一个套皮的不知年龄女性矫揉造作的坐在电脑前，对着肥宅们天真且满怀不切实际的幻想弹幕予以积极回应的这种女性职业…… 我想想就感到恶寒 无趣 我看着抽象文化的嬉笑怒骂阴阳怪气 羡慕钓鱼吧老哥的随性洒脱自由自在 笑话抗吧微博的愤世嫉俗又自甘堕落 怜悯着那些追番二次元活在幻想世界 我不懂孙笑川到底干了什么坏事，不懂浮漂是什么打窝是什么，不懂职业比赛规则也没看过海贼火影 我关注着一切，却又不在乎一切 我流连其中，好似清醒的神在审视人间 一如我孤独的朋友圈与狭隘的眼界 我很难再深入的了解某件事物，毕竟之后都会分别 为了逃避最后的火药，我选择视而不见，我选择错过美好的火花 但渐渐的，我发现我的冲浪文化圈里总有个粉红小矮子的影子，在评论区，在谁的签名里，在首页刷到，在不相干的视频下 估计又是哪家传媒公司来下场割一波，这炒作钱不少，抽象圈都能买到，挺牛 一两周过后就销声匿迹吧，我这么想着 但渐渐的 她的身影越来越清晰，如一声春雷后的细雨戚戚沥沥的声响越来越明显，好似催促一般盈盈牵住了我的视线 我终于点开了几个视频，看到了难以理解的评论圈，是我熟悉的抽象文化，但我却一时半会看不出他们刷的评论与这套皮主播视频内容之间有任何关联 我好奇起来了，一连几个视频都是这般，评论区那些刷着小作文的鼠鼠与我往日见到的不同，他们在尽他们所能吸引住每个初来者，这可不像鼠鼠作风 我喜欢鼠鼠是因为我觉得他们和我一样烂 一样的自甘堕落一样的得过且过 也许往后某天我也会自称鼠鼠 也许明天，也许现在就写在这篇 但这些鼠鼠不一样，我看见了鲜活的情绪，我看见了被波澜平淡囚禁后的渴望 他们有着热情，他们真的欢笑，他们仿佛在布置新家一般张灯结彩呼朋引伴地活跃着，他们自称着溺水却开始奋力击打起浪花 最有趣的还属一个防过度搬运的“枝网查重” 他们不像是真的鼠鼠，和往日极端情感极端言辞下，好像有新的东西在燃烧 说出来很可耻、很羞耻，很不符合我平时强装严肃实则糜烂的自闭内敛 但我想说，那个东西好像是 希望、梦想 是一些美好的信任是敢于托付的喜爱 这什么主播?能把鼠鼠捞上来? 我点开了一部切片 心里好像有什么早已麻木不堪的东西在呼救 我与嘉然相遇那天，我永远会觉得该早一点 这样爱自己也能更早点 剖开来，站在阳光下 她就这么走向前来,"I've always been unable to see a set of virtual hosts of unknown age women who are making their own way to the computer, sitting in front of the computer, pitying those who pursue the second dimensional living in a fantasy world, but I don't know what the naïve and unrealistic fantasy screen is doing to the fat people... I think I'm feeling badly uninterested. I think I'm watching the laughter of abstract culture, but I don't care how much more I feel about it. I think that the more people who watch the rat rat rat rat rat rat rat rat rat rat rat rat rat rat rat rat rat rat rat rat rat rat rat rat rat rat rat rat rat rat rat rat rat rat rat rat rat rat rat rat rat rat rat rat rat rat rat rat rat rat rat rat rat rat rat rat rat rat rat rat rat rat rat rat rat rat rat rat rat rat rat rat rat rat rat rat rat rat rat rat rat rat rat rat rat rat rat rat rat rat rat rat rat rat rat rat rat rat rat rat rat rat rat rat rat rat rat rat rat rat rat rat rat rat rat rat rat rat rat rat rat rat rat rat","I've always been unable to see a set of virtual hosts of unknown age women who are making their own way to the computer, sitting in front of the computer, pitying those who pursue the second dimensional living in a fantasy world, but I don't know what the nave and unrealistic fantasy screen is doing to the fat people... I think I'm feeling badly uninterested. I think I'm watching the laughter of abstract culture, but I don't care how much more I feel about it. I think that the more people who watch the rat rat rat rat rat rat rat rat rat rat rat rat rat rat rat rat rat rat rat rat rat rat rat rat rat rat rat rat rat rat rat rat rat rat rat rat rat rat rat rat rat rat rat rat rat rat rat rat rat rat rat rat rat rat rat rat rat rat rat rat rat rat rat rat rat rat rat rat rat rat rat rat rat rat rat rat rat rat rat rat rat rat rat rat rat rat rat rat rat rat rat rat rat rat rat rat rat rat rat rat rat rat rat rat rat rat rat rat rat rat rat rat rat rat rat rat rat rat rat rat rat rat rat rat"
98427667,schinese,以前的我一向是看不起虚拟主播的 一个套皮的不知年龄女性矫揉造作的坐在电脑前，对着肥宅们天真且满怀不切实际的幻想弹幕予以积极回应的这种女性职业…… 我想想就感到恶寒 无趣 我看着抽象文化的嬉笑怒骂阴阳怪气 羡慕钓鱼吧老哥的随性洒脱自由自在 笑话抗吧微博的愤世嫉俗又自甘堕落 怜悯着那些追番二次元活在幻想世界 我不懂孙笑川到底干了什么坏事，不懂浮漂是什么打窝是什么，不懂职业比赛规则也没看过海贼火影 我关注着一切，却又不在乎一切 我流连其中，好似清醒的神在审视人间 一如我孤独的朋友圈与狭隘的眼界 我很难再深入的了解某件事物，毕竟之后都会分别 为了逃避最后的火药，我选择视而不见，我选择错过美好的火花 但渐渐的，我发现我的冲浪文化圈里总有个粉红小矮子的影子，在评论区，在谁的签名里，在首页刷到，在不相干的视频下 估计又是哪家传媒公司来下场割一波，这炒作钱不少，抽象圈都能买到，挺牛 一两周过后就销声匿迹吧，我这么想着 但渐渐的 她的身影越来越清晰，如一声春雷后的细雨戚戚沥沥的声响越来越明显，好似催促一般盈盈牵住了我的视线 我终于点开了几个视频，看到了难以理解的评论圈，是我熟悉的抽象文化，但我却一时半会看不出他们刷的评论与这套皮主播视频内容之间有任何关联 我好奇起来了，一连几个视频都是这般，评论区那些刷着小作文的鼠鼠与我往日见到的不同，他们在尽他们所能吸引住每个初来者，这可不像鼠鼠作风 我喜欢鼠鼠是因为我觉得他们和我一样烂 一样的自甘堕落一样的得过且过 也许往后某天我也会自称鼠鼠 也许明天，也许现在就写在这篇 但这些鼠鼠不一样，我看见了鲜活的情绪，我看见了被波澜平淡囚禁后的渴望 他们有着热情，他们真的欢笑，他们仿佛在布置新家一般张灯结彩呼朋引伴地活跃着，他们自称着溺水却开始奋力击打起浪花 最有趣的还属一个防过度搬运的“枝网查重” 他们不像是真的鼠鼠，和往日极端情感极端言辞下，好像有新的东西在燃烧 说出来很可耻、很羞耻，很不符合我平时强装严肃实则糜烂的自闭内敛 但我想说，那个东西好像是 希望、梦想 是一些美好的信任是敢于托付的喜爱 这什么主播?能把鼠鼠捞上来? 我点开了一部切片 心里好像有什么早已麻木不堪的东西在呼救 我与嘉然相遇那天，我永远会觉得该早一点 这样爱自己也能更早点 剖开来，站在阳光下 她就这么走向前来,"I've always been unable to see a set of virtual hosts of unknown age women who are making their own way to the computer, sitting in front of the computer, pitying those who pursue the second dimensional living in a fantasy world, but I don't know what the naïve and unrealistic fantasy screen is doing to the fat people... I think I'm feeling badly uninterested. I think I'm watching the laughter of abstract culture, but I don't care how much more I feel about it. I think that the more people who watch the rat rat rat rat rat rat rat rat rat rat rat rat rat rat rat rat rat rat rat rat rat rat rat rat rat rat rat rat rat rat rat rat rat rat rat rat rat rat rat rat rat rat rat rat rat rat rat rat rat rat rat rat rat rat rat rat rat rat rat rat rat rat rat rat rat rat rat rat rat rat rat rat rat rat rat rat rat rat rat rat rat rat rat rat rat rat rat rat rat rat rat rat rat rat rat rat rat rat rat rat rat rat rat rat rat rat rat rat rat rat rat rat rat rat rat rat rat rat rat rat rat rat rat rat","I've always been unable to see a set of virtual hosts of unknown age women who are making their own way to the computer, sitting in front of the computer, pitying those who pursue the second dimensional living in a fantasy world, but I don't know what the nave and unrealistic fantasy screen is doing to the fat people... I think I'm feeling badly uninterested. I think I'm watching the laughter of abstract culture, but I don't care how much more I feel about it. I think that the more people who watch the rat rat rat rat rat rat rat rat rat rat rat rat rat rat rat rat rat rat rat rat rat rat rat rat rat rat rat rat rat rat rat rat rat rat rat rat rat rat rat rat rat rat rat rat rat rat rat rat rat rat rat rat rat rat rat rat rat rat rat rat rat rat rat rat rat rat rat rat rat rat rat rat rat rat rat rat rat rat rat rat rat rat rat rat rat rat rat rat rat rat rat rat rat rat rat rat rat rat rat rat rat rat rat rat rat rat rat rat rat rat rat rat rat rat rat rat rat rat rat rat rat rat rat rat"
94464025,schinese,作为一个铁血顶碗人，我都有点不好意思了，里面晚晚的戏份真的太重了 作为面向所有一个魂的故事，还是有些片面了，但是从制作游戏日程方面来说，已经是极致了 我也是一个文字工作者，虽然这里面还是透露着一些中学生的文字稚嫩感 但是文字的可读性真的很好了，看得出经过了用心的雕琢 可以出枝江往事2，重点说说贝贝珈和奶淇淋双向奔赴的故事 还有，看到了关于英文版的评测建议，我是英语文学专业的，如果有翻译需求可以找我,"As a top-of-the-line player, I'm a little uncomfortable, and the late night part is really heavy as a story that is all about one soul, but it's a bit fragmentary, but in terms of the game schedule, it's extreme. I'm also a word worker, although here some middle schoolers still have a naïve sense of writing.","As a top-of-the-line player, I'm a little uncomfortable, and the late night part is really heavy as a story that is all about one soul, but it's a bit fragmentary, but in terms of the game schedule, it's extreme. I'm also a word worker, although here some middle schoolers still have a nave sense of writing."
144816972,brazilian,"Embora tenha na descrição da página da Steam a indicação de “Um jogador”, o foco do [b]eFootball™ 2023[/b] é totalmente no modo online, que é onde reina as microtransações.  De “Um jogador” você só tem uns eventos sem graça e umas partidas de “amistosos” com alguns clubes. Não dá – ou pelo menos não achei onde – para fazer uma partida entre seleções de países.  Mas não é só isso: o jogo em si é muito “capenga”. O HUD é estranho de navegar. Poucas opções de personalização no geral. Gráficos do PS3/X360. Narração em Português do Brasil “mecânica” e sem emoção. Jogabilidade ruim.  O fato é que hoje em dia, APESAR DOS PESARES, deixaram o [url=https://store.steampowered.com/app/1811260/EA_SPORTS_FIFA_23/][i]EA SPORTS™ FIFA 23[/i][/url] sem concorrência, porque mesmo com todos seus poréns, o FIFA 23 é o melhor jogo eletrônico de futebol até o momento em que escrevo esta análise. Vale muito mais a pena você esperar uma boa promoção e pegar o FIFA 23 por R$ 75 do que gastar com qualquer microtransação neste jogo.  Caso R$ 75 seja caro para o seu orçamento ou você não goste do FIFA por alguma razão, então eu recomendo o [url=https://store.steampowered.com/app/1620540/Pixel_Cup_Soccer__Ultimate_Edition/][i]Pixel Cup Soccer - Ultimate Edition[/i][/url] ou o [url=https://store.steampowered.com/app/2283380/Charrua_Soccer/][i]Charrua Soccer - Pro Edition[/i][/url], que são dos mesmos desenvolvedores ([url=https://store.steampowered.com/publisher/batovigames][i]BATOVI Games[/i][/url], um estúdio indie uruguaio). Você pega por R$ 30 cada um em uma promoção. Embora esses jogos possuam gráficos em pixel art e no estilo “low poly”, eles são muito mais divertidos e personalizáveis do que esta bomba de eFootball™ 2023.  Se você é um jogador casual de jogos de futebol como eu e que não se importa com o multiplayer online, com certeza este jogo não é para você. E mesmo que você goste de jogar partidas online eu ainda assim não recomendo. A máxima do “de graça até injeção na testa” não funciona aqui. Junte uns trocados e compre um dos jogos que eu sugeri acima.","Although it has A player in the Steam page description, the focus of [b]eFootballTM 2023[/b] is entirely on the online gameplay mode, which is where microtransactions reign. From A player you only have a few free events and some friendly games with some clubs. There is no  or at least I didn't find  to make a match between selections of countries. But not only that: the game itself is very capenga. The HIO is unusual for navigating. Few games are available for purchase in general. Games for PS3/X360. Narration in Portuguese mecânica  and these games are very emotional. Unfortunately, you can't expect a game without a game today.[https://www.pedia.org/www.pedia.org/www.pedia.org/www.pedia.org/www.pedia.org/www.pedia.org/www.pedia.org/www.pedia.org/www.pedia.org/www.pedia/www.pedia.org/www","Although it has A player in the Steam page description, the focus of [b]eFootballTM 2023[/b] is entirely on the online gameplay mode, which is where microtransactions reign. From A player you only have a few free events and some friendly games with some clubs. There is no  or at least I didn't find  to make a match between selections of countries. But not only that: the game itself is very capenga. The HIO is unusual for navigating. Few games are available for purchase in general. Games for PS3/X360. Narration in Portuguese mecnica  and these games are very emotional. Unfortunately, you can't expect a game without a game today.[https://www.pedia.org/www.pedia.org/www.pedia.org/www.pedia.org/www.pedia.org/www.pedia.org/www.pedia.org/www.pedia.org/www.pedia.org/www.pedia/www.pedia.org/www"
122259133,english,"Tôi là fan của Dutstudio được 20 năm nay rồi. Còn nhớ hồi bé, với cái máy tính cà tàng, bố tôi mở một game của team DUT lên, tôi ngồi chơi cùng, chợt thấy cuốn hút bởi những chiến thuật,lối đánh hấp dẫn, bởi gameplay với sự nhiệt huyết, máu lửa, với những pha combat tuyệt đỉnh . Và thế là tôi đã đem lòng yêu Dutstudio từ đó . Tôi bắt đầu lên mạng tìm thông tin, những điểm thú vị và thông tin bên lề của Dutstudio, và càng thêm yêu họ hơn. Trải qua bao nhiêu năm tháng thăng trầm cùng team Đụt, dù có những game bị flop và ít người mua, tôi vẫn mãi giữ lửa tình yêu với team Đụt và các Cter. Để rồi đến ngày hôm nay, khi được chứng kiến thời khắc lịch sử của Dutstudio ra mắt Thần Trùng chính thức trong tôi lại bùng cháy lên cảm xúc một lần nữa, mãnh liệt hệt như lần đầu tiên mà tôi xem Trailer vậy.","Tôi là fan của Dutstudio được 20 năm nay rồi. Còn nhớ hồi bé, với cái máy tính cà tàng, bố tôi mở một game của team DUT lên, tôi ngồi chơi cùng, chợt thấy cuốn hút bởi những chiến thuật,lối đánh hấp dẫn, bởi gameplay với sự nhiệt huyết, máu lửa, với những pha combat tuyệt đỉnh . Và thế là tôi đã đem lòng yêu Dutstudio từ đó . Tôi bắt đầu lên mạng tìm thông tin, những điểm thú vị và thông tin bên lề của Dutstudio, và càng thêm yêu họ hơn. Trải qua bao nhiêu năm tháng thăng trầm cùng team Đụt, dù có những game bị flop và ít người mua, tôi vẫn mãi giữ lửa tình yêu với team Đụt và các Cter. Để rồi đến ngày hôm nay, khi được chứng kiến thời khắc lịch sử của Dutstudio ra mắt Thần Trùng chính thức trong tôi lại bùng cháy lên cảm xúc một lần nữa, mãnh liệt hệt như lần đầu tiên mà tôi xem Trailer vậy.","Ti l fan ca Dutstudio c 20 nm nay ri. Cn nh hi b, vi ci my tnh c tng, b ti m mt game ca team DUT ln, ti ngi chi cng, cht thy cun ht bi nhng chin thut,li nh hp dn, bi gameplay vi s nhit huyt, mu la, vi nhng pha combat tuyt nh . V th l ti  em lng yu Dutstudio t  . Ti bt u ln mng tm thng tin, nhng im th v va thng tin bn l ca Dutstudio, v cng thm yu h hn. Tri qua bao nhiu nm thng thng trm cng team t, d c nhng game b flop va t ngi mua, ti vn mi gi la tnh yu vi team t va cc Cter.  ri n ngy hm nay, khi c chng kin thi khc lch s ca Dutstudio ra mt Thn Trng chnh thc trong ti li bng chy ln cm xc mt ln na, mnh lit ht nh ln u tin m ti xem Trailer vy."
113337372,english,"Old Fashioned Pumpkin Pie  2 large eggs 1 large egg yolk 1/2 cup packed dark brown sugar 1/3 cup white sugar 1/2 teaspoon salt 2 teaspoons cinnamon 1 teaspoon ground ginger 1/4 teaspoon ground nutmeg 1/4 teaspoon ground cloves 1/8 teaspoon cardamom 1/2 teaspoon finely grated lemon zest 2 cups pumpkin purée from a sugar pumpkin (see Recipe Note) OR 1 (15-ounce can) pumpkin purée (can also use puréed cooked butternut squash) 1 1/2 cups heavy cream or 1 (12-ounce) can evaporated milk 1 homemade pie crust, chilled or frozen (see pâte brisée recipe or our no-fail flaky pie crust recipe), or 2 pre-made pie shells  Preheat the oven: Preheat your oven to 425°F. Make the filling: Beat the eggs in a large bowl. Mix in the brown sugar, white sugar, salt, spices — cinnamon, ground ginger, nutmeg, ground cloves, cardamom, and lemon zest. Mix in the pumpkin purée. Stir in the cream. Beat together until everything is well mixed. mixing pumpkin pie ingredients pumpkin pie ingredients mixed well adding cream to pumpkin pie puree pumpkin pie filling ready to add to pie Fill the pie shell and bake: Pour the filling into an uncooked chilled or frozen pie shell. Bake at a high temperature of 425°F for 15 minutes. Then after 15 minutes, lower the temperature to 350°F. Bake for 45 to 55 minutes more. The pie is done when a knife tip inserted in the center comes out wet but relatively clean. The center should be just barely jiggly. (About half-way through the baking, you may want to put foil around the edges or use a pie protector to keep the crust from getting too browned.) Note that the pumpkin pie will come out of the oven all puffed up (from the leavening of the eggs), and will deflate as it cools. pumpkin pie in dish ready for baking Baked Pumpkin Pie From Scratch Cool the pie on a rack, then serve: Cool the pumpkin pie on a wire rack for 2 hours. Serve with whipped cream.","Old Fashioned Pumpkin Pie  2 large eggs 1 large egg yolk 1/2 cup packed dark brown sugar 1/3 cup white sugar 1/2 teaspoon salt 2 teaspoons cinnamon 1 teaspoon ground ginger 1/4 teaspoon ground nutmeg 1/4 teaspoon ground cloves 1/8 teaspoon cardamom 1/2 teaspoon finely grated lemon zest 2 cups pumpkin purée from a sugar pumpkin (see Recipe Note) OR 1 (15-ounce can) pumpkin purée (can also use puréed cooked butternut squash) 1 1/2 cups heavy cream or 1 (12-ounce) can evaporated milk 1 homemade pie crust, chilled or frozen (see pâte brisée recipe or our no-fail flaky pie crust recipe), or 2 pre-made pie shells  Preheat the oven: Preheat your oven to 425°F. Make the filling: Beat the eggs in a large bowl. Mix in the brown sugar, white sugar, salt, spices — cinnamon, ground ginger, nutmeg, ground cloves, cardamom, and lemon zest. Mix in the pumpkin purée. Stir in the cream. Beat together until everything is well mixed. mixing pumpkin pie ingredients pumpkin pie ingredients mixed well adding cream to pumpkin pie puree pumpkin pie filling ready to add to pie Fill the pie shell and bake: Pour the filling into an uncooked chilled or frozen pie shell. Bake at a high temperature of 425°F for 15 minutes. Then after 15 minutes, lower the temperature to 350°F. Bake for 45 to 55 minutes more. The pie is done when a knife tip inserted in the center comes out wet but relatively clean. The center should be just barely jiggly. (About half-way through the baking, you may want to put foil around the edges or use a pie protector to keep the crust from getting too browned.) Note that the pumpkin pie will come out of the oven all puffed up (from the leavening of the eggs), and will deflate as it cools. pumpkin pie in dish ready for baking Baked Pumpkin Pie From Scratch Cool the pie on a rack, then serve: Cool the pumpkin pie on a wire rack for 2 hours. Serve with whipped cream.","Old Fashioned Pumpkin Pie  2 large eggs 1 large egg yolk 1/2 cup packed dark brown sugar 1/3 cup white sugar 1/2 teaspoon salt 2 teaspoons cinnamon 1 teaspoon ground ginger 1/4 teaspoon ground nutmeg 1/4 teaspoon ground cloves 1/8 teaspoon cardamom 1/2 teaspoon finely grated lemon zest 2 cups pumpkin pure from a sugar pumpkin (see Recipe Note) OR 1 (15-ounce can) pumpkin pure (can also use pured cooked butternut squash) 1 1/2 cups heavy cream or 1 (12-ounce) can evaporated milk 1 homemade pie crust, chilled or frozen (see pte brise recipe or our no-fail flaky pie crust recipe), or 2 pre-made pie shells  Preheat the oven: Preheat your oven to 425F. Make the filling: Beat the eggs in a large bowl. Mix in the brown sugar, white sugar, salt, spices  cinnamon, ground ginger, nutmeg, ground cloves, cardamom, and lemon zest. Mix in the pumpkin pure. Stir in the cream. Beat together until everything is well mixed. mixing pumpkin pie ingredients pumpkin pie ingredients mixed well adding cream to pumpkin pie puree pumpkin pie filling ready to add to pie Fill the pie shell and bake: Pour the filling into an uncooked chilled or frozen pie shell. Bake at a high temperature of 425F for 15 minutes. Then after 15 minutes, lower the temperature to 350F. Bake for 45 to 55 minutes more. The pie is done when a knife tip inserted in the center comes out wet but relatively clean. The center should be just barely jiggly. (About half-way through the baking, you may want to put foil around the edges or use a pie protector to keep the crust from getting too browned.) Note that the pumpkin pie will come out of the oven all puffed up (from the leavening of the eggs), and will deflate as it cools. pumpkin pie in dish ready for baking Baked Pumpkin Pie From Scratch Cool the pie on a rack, then serve: Cool the pumpkin pie on a wire rack for 2 hours. Serve with whipped cream."
