recommendationid,language,review,translated_en,translated_en_fixed
97361442,english,"[h1][b] Brawlhalla is a unique 2d platform fighting game and has incomparable mechanics to other fighting games.[/b][/h1]  [b]This is my experience after 2300 hours poured for this game.[/b]  [b][u]Pros:[/u][/b] 1. Easy to learn 2. No cheaters 3. Not P2W 4. It's Free  [b][u]Cons:[/u][/b] 1. Toxic Community 2. Bad Server 3. N̶e̵e̶d̷s̵ ̶g̶o̷o̴d̴ ̶I̵n̵t̸e̷r̶n̶e̷t̶ 4. W̷i̷l̷l̶ ̸r̵u̸i̵n̵ ̴y̴o̶u̶r̸ ̴l̴i̴f̸e̵  5. [b]G̷̨̫̳̀̚A̷͚̎M̶̡̖̑̈́Ḇ̶̅̇̿͜L̶̟̈́Ȅ̵͕̈́ ̴͓͗M̶̩͉̺̈́̓O̸̜͎̒̓Ņ̷̰̘̃̑̔E̷͂̀́͜Y̸̛̩͋͑[/b]  6. [b]B̵̲̜̻͐͒R̷̨̛͕̖͔̹̹͊̌̀̓E̷̡̗͚̘̬̥͑̔́͠À̷̫̤Ḱ̵̛̝̰̍̂͜͠S̵̻͇̈͌̂̈́ ̸̖̪͉̼̖̜̊̑M̶̧̧̪̖̭̓̆̒͌́͜E̵̢͓̹̼̮̦͑̃͜N̴͔̞̞͌̈́́̉̄̀̚T̸̡̖̣͇̱̗̽͊̈̅̒͌Á̵̱̙̮̯̍̉͐̈́Ļ̵̛̥͛́̍̍̂[/b]    7. [b]N̴̛̞͚̻̮͖̱̋̄̓̏̌̒̓͑͆͂͒̑͑̚͘̕͠ͅĘ̸͎͈͇͓̻̬̱͑̋̓̅̆͆̽̉͠ͅE̸̡̡̢̺̖͎̙͐̍̈̀͠Ḑ̸͎̣̪̞͇̰͚̮̺̳͒̓̿ ̸̢̧̣͈̥̯̤̠̪͇̖̜̅̑̅̅̿̅̀̀͆̃̀̎̎̿̅͒̎̓͒̅͌T̷̨̨̧̧̛̘̣͖̣̠̤̻̣̥̞͙͔̗͍̍̓̌Ö̵̩̀͂̈́̍̃͆͗̈̍̀̌̎̕ ̶̦̹̑̏̕S̴̢̢̢̜̫͔͙̯̞̱͈͚̪̻̜̱̠͚̏̈́̒̾̈́̒̔̏̎͋͊̌͆̀̍̾̏͛͗͗͝ͅE̴̢̧͉̗̘̱̪̲̯̱̦͕͋͂͘͜L̵̼̞͎̫͈̭̣̱̲̪̣̮̥͚͙͉͇͇̂̅̓͝͠ͅĻ̴̛̛͇̲̺͂̈́́͛̆̿͐̎̆̑̄̀͂͐̚͘͝ͅ ̴̨̖͈̥̘̤̙̲͉̰͓̣͙̦̈̏̓̽̈́͌͋̋͜͠Y̵̨̨̞̖̱͙̖̙͇̝͕̖̩̟̯̅̐̽͐̈́̿̑̚͜͜͠ͅͅO̶͕̎̓̔̈́̈̈́̐̾̈͠Ů̵̢̡̨̮̗̰̬̝͈͇̼̱̱̦̲͔̭̩̲̣̓̚ͅR̵̡̧̼̩̗̫̼̝̗̭̪͙͈̘̰͖̞̟̞̫̻̈́̓͐̍̈́͒́̂̕͝͝ ̸̧̛̗̥͙͕̘̖̪̬̭̮͇̩͋̈́͐̅̉̕͝S̵͍̬̥̥̅̅̅̓̓̚O̴̬͂͌̂̎͋͑̍̈́͒̾̎͘̚̚͝͝Ụ̵͕̹̙̲̓͆͑Ḽ̴̢̹̦͈̥͓̦̳̭̣̗̒̿̒̃̈́̌͑̄͋̈́̓͛̈́̚̚̕͝ ̶̨̛̖̩̠͔̙̬̲̹͍̱̼̋̉͆̄̿̾̽̒̎͋̏̂͐̎͝͝͠ͅͅT̷̮̭̹̖̞̖̺̄͊̇ͅƠ̸̮̹͎̯̋͋̇̆͋̔̿̑̀̉̾̊͝ͅ ̶̮̀̈́̑̃͐̈́̓̌͒͊̉̈́̐̌͐̕̚̚͝͝ͅB̵̨̧̺̙̼̞̮̙͈̫̫̠̭͇̥̩̺̓̅̊̏̽̈͂̈́̀̍̐̉̕̚͜͝E̸̦̦̟̊̓̒͒͋͊̂̽͆͐̈́̾̚͝ ̷̱͇̩͖̰͙͇̮͚̥̦̻̗̿̿̈́̑̀͛͛̂̔̋̇̕ͅG̵̨̨͎͎̪̰̜̣̻̲̣̼̣̫̯͛͜ͅO̶̒͆̐̅͜͝Ǫ̷͉̳̣͔̖̰͉͙͚̆̈̓̊͘ͅḒ̸͎̺͚̿͊͂͛͗̀̀̅͛́̽̎͂͋͐̈͝͝[/b]    8. Smurfs in rank  Even with all that cons, I would still recommend [b]B̷̧͎̜̟͖͉̱̟̕r̸̯̜̮͔̜̖̄͛̒̿͆̋͘ä̷̬̩̤́̎̓̔̓̈̓̈͊̔̈́͠w̴͉͈͚̥͙̪͔͂̽͐͝l̷̤͍̳̺͖̈́̇̈́̿̎̎̇͊͘̚̕h̵̼̰̜̏̐̍̄̐̽̓̓̐̕͘ā̸̧̟̯͓͑́ḽ̶̛͙̯́̂̐̇̈͘ä̷̭͔̙͊̅̉͑̉́̽̐l̷̢̤͉̼̼̹̣͚̟̥̊͌̓ͅ[/b]. It's fun, addictive, [b]B̶̢̛̥̜͔̖̰̰̫̈́̉r̵̡̼͚̫͔̹̪̝͎͒͒̏̈́̈́͆ȩ̴͓̙̫͓͔̿̅̾̇̋̂̆͌̅̚̕ą̴̫̙̲͐̒̽͊͆͑́̋̈̍̄k̴̛̥̖̊͂̋͆͑̔̍̚s̷̲̟̤͑͆̑̚͝͝ ̶̪͍͔͗͐̏̒͒͌̀͗̒̒͋̄y̴̡̧̛̛͔̗̦̥̯͕̯͉̾͊̔̈́͌̒̐̾o̵̺̖̮̳̝̅̂ư̵̧̡̢̳̤̪̦̜͉̮̻̜̓̈́̔̽̆͘͝͝r̶͔̱̫͈̼͎̥̍̐̿͠ ̵̤̮̉̀͌̈ṁ̶̢͚̰̼͉̮̟̞͕͋͝ẻ̸̜̳̘̞̜͉̱̈́͂̅͘͜ņ̵̡̟̳͉̪̦̱̈̏͐̔͛̃̏̔̊̉͝ţ̷̛͙͔̣͙̬́a̵̧̲̖̮̳̽͝l̶̗͖̫̲̻̜͖̘̈̓̂̏̏[/b], Straight learning curve for a beginner.  Just download this game and press that green play button so that    [b]S̸̢̝͖̟̯͛̉̒̂̀̐͜͝A̷̧̰̮̠̼̼̣̣̎́͠Ţ̸̨̛͙̫̫̗̝͎̟̙͇͖͙͈̹̖̍̽̅̑́͋̋͌͒Ã̴͖̪̬̈́̒̋̃̆̊͘ͅN̵̛̘͍͍̘̼̊s̸̢̖̰͔̫̥̒́̎̄̆̉ ̷̢̡̺̐̽̏̉̊̚K̵̩͉̤͓̘̮̈̓͗̾̆̿̀̾̍̃̽́̿͝N̴̬͇̠̝̟̈́Ơ̴̧͍̘͎̱̣̲̣͚̇́̅̕W̵̝̪͔̫̹̹̖̟̿̄̊́͋͘ ̵͈̟͓͍̭͑͂̉̋́̇̅̉̈́͑͘̕͝͝Ŷ̴̨͚̮̭̘̺͔͓͘Ơ̴̛̠̟̖̞͎͉̬͑̐̋͑̂̚̚̕͠Ų̴̧̢̯͕̦̫͎͎͎̮̜̫̤̳̓͆́͂̾̍͗̕ ̴̛̛͍͓̋͑͒̔̈́̾̏́͋̈́̄̈͝͠Ą̶̹͍̟͖͔̯̠̖̳̺̺̮̘̐̇̐́̋̀̉̈R̸̤̣̖̙͔̜̙̙̻̖͎̝̙̪̭͐̐̏͒E̸̛̛̯͍̟̗̿̓̽̉̐ ̶̡͇̪̞̯͈̜̪̇̊̓͒͘G̸͓͎̖̗͙̣̹͐̈̌̉̓̓͘͝I̷̘̙̫̳̱̳͔̗͓̗̩̖̹̳̒͆̿̒͠V̵̡̹̮̮̬̳͉̗̙̖̯͈͈̣̝̒͐̂̈́̈́̃̈̋͘͘͘Ì̷̛̦̯͕̖̣̮̲̰̙̝̖͎̜̪̠̏̆̄̆̇̍̏͛̇͋̽̽͘Ṇ̸̳̜̻̫͎̝͍̺̠̟̉͜Ģ̴̛̤͍̝̩͚͚̜͔̖̃͑̔́̓̓̈̾̅̓̈́̍͘̕̚ ̸͍͚͔͍̂̅̅͒͐̌̈̊͐̾Ỳ̴͙̞̯̗͉̯̓̏̏͂̍͂̾̅̇͐̅͠͠O̴̲͂̃̉͐̓͐̉̒̚Ụ̷͍̰̱̩̮̰̹̦̱̽́̍̎́̅̊̿̓̀̔̔͝R̴͍̽̾́̂͆̄͐̀̈́̂͝ ̵̛̛̥̇̈́̆͜S̵̢̭̠̣̻͉̥̲͉̤̣̜̝̭̟̀͌̈́̚̚͝Ỏ̴͍̖̈́́͛̉̓U̷͇͈̬̫̅͐̋̂̽͌̑̈̕͠Ľ̴̠̜̝̼͍͇̪̪̤̪͈̟̣̲̄͑͑̍̅̿̀͛͑̇͌͜͠ ̶͎̆͋͂͂͌̏̊́͊͋͒͘Ṯ̷͍̬̱͍̪͊̀̈̎̏̐̓͛͊͊̓͘Ọ̶̬͔̪̥̫̣̭̫̳̦̖̞̜̗̆̋͐͗͑̋̽̕͜ ̵̡̛̖̜̝͓̖̭̜̞͇̣̤̟̜̠̿͂̀̃͆̀͐Ḩ̵̛̛̳͓͇̻̬̩̘̫̫̟̳̘̯̠̓̿̓͆̏́̈́̉͌̂́̀͜I̵̡̢̠͚͈̳͉͈̫̖̬̜̹̱͕͆̋̊̏̌̇̔̓͒͑̊M̷̺̩̫͙͕̣͕̹̜̒͐͌͗̽͗͊͌̿̽͊͊̂͠[/b]. Good luck have fun Brawlers :D","[h1][b] Brawlhalla is a unique 2d platform fighting game and has incomparable mechanics to other fighting games.[/b][/h1]  [b]This is my experience after 2300 hours poured for this game.[/b]  [b][u]Pros:[/u][/b] 1. Easy to learn 2. No cheaters 3. Not P2W 4. It's Free  [b][u]Cons:[/u][/b] 1. Toxic Community 2. Bad Server 3. N̶e̵e̶d̷s̵ ̶g̶o̷o̴d̴ ̶I̵n̵t̸e̷r̶n̶e̷t̶ 4. W̷i̷l̷l̶ ̸r̵u̸i̵n̵ ̴y̴o̶u̶r̸ ̴l̴i̴f̸e̵  5. [b]G̷̨̫̳̀̚A̷͚̎M̶̡̖̑̈́Ḇ̶̅̇̿͜L̶̟̈́Ȅ̵͕̈́ ̴͓͗M̶̩͉̺̈́̓O̸̜͎̒̓Ņ̷̰̘̃̑̔E̷͂̀́͜Y̸̛̩͋͑[/b]  6. [b]B̵̲̜̻͐͒R̷̨̛͕̖͔̹̹͊̌̀̓E̷̡̗͚̘̬̥͑̔́͠À̷̫̤Ḱ̵̛̝̰̍̂͜͠S̵̻͇̈͌̂̈́ ̸̖̪͉̼̖̜̊̑M̶̧̧̪̖̭̓̆̒͌́͜E̵̢͓̹̼̮̦͑̃͜N̴͔̞̞͌̈́́̉̄̀̚T̸̡̖̣͇̱̗̽͊̈̅̒͌Á̵̱̙̮̯̍̉͐̈́Ļ̵̛̥͛́̍̍̂[/b]    7. [b]N̴̛̞͚̻̮͖̱̋̄̓̏̌̒̓͑͆͂͒̑͑̚͘̕͠ͅĘ̸͎͈͇͓̻̬̱͑̋̓̅̆͆̽̉͠ͅE̸̡̡̢̺̖͎̙͐̍̈̀͠Ḑ̸͎̣̪̞͇̰͚̮̺̳͒̓̿ ̸̢̧̣͈̥̯̤̠̪͇̖̜̅̑̅̅̿̅̀̀͆̃̀̎̎̿̅͒̎̓͒̅͌T̷̨̨̧̧̛̘̣͖̣̠̤̻̣̥̞͙͔̗͍̍̓̌Ö̵̩̀͂̈́̍̃͆͗̈̍̀̌̎̕ ̶̦̹̑̏̕S̴̢̢̢̜̫͔͙̯̞̱͈͚̪̻̜̱̠͚̏̈́̒̾̈́̒̔̏̎͋͊̌͆̀̍̾̏͛͗͗͝ͅE̴̢̧͉̗̘̱̪̲̯̱̦͕͋͂͘͜L̵̼̞͎̫͈̭̣̱̲̪̣̮̥͚͙͉͇͇̂̅̓͝͠ͅĻ̴̛̛͇̲̺͂̈́́͛̆̿͐̎̆̑̄̀͂͐̚͘͝ͅ ̴̨̖͈̥̘̤̙̲͉̰͓̣͙̦̈̏̓̽̈́͌͋̋͜͠Y̵̨̨̞̖̱͙̖̙͇̝͕̖̩̟̯̅̐̽͐̈́̿̑̚͜͜͠ͅͅO̶͕̎̓̔̈́̈̈́̐̾̈͠Ů̵̢̡̨̮̗̰̬̝͈͇̼̱̱̦̲͔̭̩̲̣̓̚ͅR̵̡̧̼̩̗̫̼̝̗̭̪͙͈̘̰͖̞̟̞̫̻̈́̓͐̍̈́͒́̂̕͝͝ ̸̧̛̗̥͙͕̘̖̪̬̭̮͇̩͋̈́͐̅̉̕͝S̵͍̬̥̥̅̅̅̓̓̚O̴̬͂͌̂̎͋͑̍̈́͒̾̎͘̚̚͝͝Ụ̵͕̹̙̲̓͆͑Ḽ̴̢̹̦͈̥͓̦̳̭̣̗̒̿̒̃̈́̌͑̄͋̈́̓͛̈́̚̚̕͝ ̶̨̛̖̩̠͔̙̬̲̹͍̱̼̋̉͆̄̿̾̽̒̎͋̏̂͐̎͝͝͠ͅͅT̷̮̭̹̖̞̖̺̄͊̇ͅƠ̸̮̹͎̯̋͋̇̆͋̔̿̑̀̉̾̊͝ͅ ̶̮̀̈́̑̃͐̈́̓̌͒͊̉̈́̐̌͐̕̚̚͝͝ͅB̵̨̧̺̙̼̞̮̙͈̫̫̠̭͇̥̩̺̓̅̊̏̽̈͂̈́̀̍̐̉̕̚͜͝E̸̦̦̟̊̓̒͒͋͊̂̽͆͐̈́̾̚͝ ̷̱͇̩͖̰͙͇̮͚̥̦̻̗̿̿̈́̑̀͛͛̂̔̋̇̕ͅG̵̨̨͎͎̪̰̜̣̻̲̣̼̣̫̯͛͜ͅO̶̒͆̐̅͜͝Ǫ̷͉̳̣͔̖̰͉͙͚̆̈̓̊͘ͅḒ̸͎̺͚̿͊͂͛͗̀̀̅͛́̽̎͂͋͐̈͝͝[/b]    8. Smurfs in rank  Even with all that cons, I would still recommend [b]B̷̧͎̜̟͖͉̱̟̕r̸̯̜̮͔̜̖̄͛̒̿͆̋͘ä̷̬̩̤́̎̓̔̓̈̓̈͊̔̈́͠w̴͉͈͚̥͙̪͔͂̽͐͝l̷̤͍̳̺͖̈́̇̈́̿̎̎̇͊͘̚̕h̵̼̰̜̏̐̍̄̐̽̓̓̐̕͘ā̸̧̟̯͓͑́ḽ̶̛͙̯́̂̐̇̈͘ä̷̭͔̙͊̅̉͑̉́̽̐l̷̢̤͉̼̼̹̣͚̟̥̊͌̓ͅ[/b]. It's fun, addictive, [b]B̶̢̛̥̜͔̖̰̰̫̈́̉r̵̡̼͚̫͔̹̪̝͎͒͒̏̈́̈́͆ȩ̴͓̙̫͓͔̿̅̾̇̋̂̆͌̅̚̕ą̴̫̙̲͐̒̽͊͆͑́̋̈̍̄k̴̛̥̖̊͂̋͆͑̔̍̚s̷̲̟̤͑͆̑̚͝͝ ̶̪͍͔͗͐̏̒͒͌̀͗̒̒͋̄y̴̡̧̛̛͔̗̦̥̯͕̯͉̾͊̔̈́͌̒̐̾o̵̺̖̮̳̝̅̂ư̵̧̡̢̳̤̪̦̜͉̮̻̜̓̈́̔̽̆͘͝͝r̶͔̱̫͈̼͎̥̍̐̿͠ ̵̤̮̉̀͌̈ṁ̶̢͚̰̼͉̮̟̞͕͋͝ẻ̸̜̳̘̞̜͉̱̈́͂̅͘͜ņ̵̡̟̳͉̪̦̱̈̏͐̔͛̃̏̔̊̉͝ţ̷̛͙͔̣͙̬́a̵̧̲̖̮̳̽͝l̶̗͖̫̲̻̜͖̘̈̓̂̏̏[/b], Straight learning curve for a beginner.  Just download this game and press that green play button so that    [b]S̸̢̝͖̟̯͛̉̒̂̀̐͜͝A̷̧̰̮̠̼̼̣̣̎́͠Ţ̸̨̛͙̫̫̗̝͎̟̙͇͖͙͈̹̖̍̽̅̑́͋̋͌͒Ã̴͖̪̬̈́̒̋̃̆̊͘ͅN̵̛̘͍͍̘̼̊s̸̢̖̰͔̫̥̒́̎̄̆̉ ̷̢̡̺̐̽̏̉̊̚K̵̩͉̤͓̘̮̈̓͗̾̆̿̀̾̍̃̽́̿͝N̴̬͇̠̝̟̈́Ơ̴̧͍̘͎̱̣̲̣͚̇́̅̕W̵̝̪͔̫̹̹̖̟̿̄̊́͋͘ ̵͈̟͓͍̭͑͂̉̋́̇̅̉̈́͑͘̕͝͝Ŷ̴̨͚̮̭̘̺͔͓͘Ơ̴̛̠̟̖̞͎͉̬͑̐̋͑̂̚̚̕͠Ų̴̧̢̯͕̦̫͎͎͎̮̜̫̤̳̓͆́͂̾̍͗̕ ̴̛̛͍͓̋͑͒̔̈́̾̏́͋̈́̄̈͝͠Ą̶̹͍̟͖͔̯̠̖̳̺̺̮̘̐̇̐́̋̀̉̈R̸̤̣̖̙͔̜̙̙̻̖͎̝̙̪̭͐̐̏͒E̸̛̛̯͍̟̗̿̓̽̉̐ ̶̡͇̪̞̯͈̜̪̇̊̓͒͘G̸͓͎̖̗͙̣̹͐̈̌̉̓̓͘͝I̷̘̙̫̳̱̳͔̗͓̗̩̖̹̳̒͆̿̒͠V̵̡̹̮̮̬̳͉̗̙̖̯͈͈̣̝̒͐̂̈́̈́̃̈̋͘͘͘Ì̷̛̦̯͕̖̣̮̲̰̙̝̖͎̜̪̠̏̆̄̆̇̍̏͛̇͋̽̽͘Ṇ̸̳̜̻̫͎̝͍̺̠̟̉͜Ģ̴̛̤͍̝̩͚͚̜͔̖̃͑̔́̓̓̈̾̅̓̈́̍͘̕̚ ̸͍͚͔͍̂̅̅͒͐̌̈̊͐̾Ỳ̴͙̞̯̗͉̯̓̏̏͂̍͂̾̅̇͐̅͠͠O̴̲͂̃̉͐̓͐̉̒̚Ụ̷͍̰̱̩̮̰̹̦̱̽́̍̎́̅̊̿̓̀̔̔͝R̴͍̽̾́̂͆̄͐̀̈́̂͝ ̵̛̛̥̇̈́̆͜S̵̢̭̠̣̻͉̥̲͉̤̣̜̝̭̟̀͌̈́̚̚͝Ỏ̴͍̖̈́́͛̉̓U̷͇͈̬̫̅͐̋̂̽͌̑̈̕͠Ľ̴̠̜̝̼͍͇̪̪̤̪͈̟̣̲̄͑͑̍̅̿̀͛͑̇͌͜͠ ̶͎̆͋͂͂͌̏̊́͊͋͒͘Ṯ̷͍̬̱͍̪͊̀̈̎̏̐̓͛͊͊̓͘Ọ̶̬͔̪̥̫̣̭̫̳̦̖̞̜̗̆̋͐͗͑̋̽̕͜ ̵̡̛̖̜̝͓̖̭̜̞͇̣̤̟̜̠̿͂̀̃͆̀͐Ḩ̵̛̛̳͓͇̻̬̩̘̫̫̟̳̘̯̠̓̿̓͆̏́̈́̉͌̂́̀͜I̵̡̢̠͚͈̳͉͈̫̖̬̜̹̱͕͆̋̊̏̌̇̔̓͒͑̊M̷̺̩̫͙͕̣͕̹̜̒͐͌͗̽͗͊͌̿̽͊͊̂͠[/b]. Good luck have fun Brawlers :D","[h1][b] Brawlhalla is a unique 2d platform fighting game and has incomparable mechanics to other fighting games.[/b][/h1]  [b]This is my experience after 2300 hours poured for this game.[/b]  [b][u]Pros:[/u][/b] 1. Easy to learn 2. No cheaters 3. Not P2W 4. It's Free  [b][u]Cons:[/u][/b] 1. Toxic Community 2. Bad Server 3. Needs good Internet 4. Will ruin your life  5. [b]GAML MOEY[/b]  6. [b]BRES MENT[/b]    7. [b]NE T SEL YOR SO T BE GO[/b]    8. Smurfs in rank  Even with all that cons, I would still recommend [b]Brwlhl[/b]. It's fun, addictive, [b]Brks yor al[/b], Straight learning curve for a beginner.  Just download this game and press that green play button so that    [b]SANs KNW  RE GIV OR SU  IM[/b]. Good luck have fun Brawlers :D"
139935445,english,"I will leave this analysis completely spontaneously and from the foundation of the soul. Many games have influenced me and made me fall in love with them since childhood, but very few have moved my heart and spirit so much. I think this is the main purpose of art, it is to create an emotional manifest in a unique way in each being. The Witcher 3 is not only possibly the greatest game in gaming history, it is possibly the greatest masterpiece you will ever experience in an in-game virtual world.   If we take all the foundations that make up a work, like a perfect cinema movie, we will evaluate soundtrack, photography, story/plot, dialogues, characters, costumes, sound, intensity, immersion, and so on. Well, you'll simply find everything here in this game, at such an exorbitant and impeccable level that it's even difficult to conceive how it was made, planned, thought and executed. Conclude the game, scrutinize it to the fullest, not only doing secondary Quests, but everything possible and I reach a final verdict here.   The Witcher 3 is the best game in my life, it is the game that will move you in every possible way, it will make you cry, laugh, nurture joy, inspire, including for your own personal life. The complete experience of this game will make you reflect and look for something more in your life, live a great remarkable story full of adventures and wonderful stories. All this for a measly few of bucks, so stop buying crappy new poorly made game for expensive price, and be a grateful person for the rest of your life for finding my comment and having lived a once-in-a-lifetime experience (if you've never played). Do I recommend? I recommend it for people who want to live great stories in their lives.  Soundtrack: 11/10 Story/Plot: 11/10 Characters: 11/10 Photography: 11/10 Cinematography: 11/10 Dialogues: 11/10 Historical Costume & Style: 11/10 Sound: 11/10 Design: 11/10 Gameplay: 11/10 Intensity: 11/10 Immersion: 11/10 Emotional Magic: 100/10  EPIC perfection!   ----------------------------------------------------------------------------------------------------------------------------  Vou deixar esta análise de forma totalmente espontânea e do alicerce da alma. Muitos jogos me marcaram e me fizeram me apaixonar desde a infância, mas pouquíssimos mexeram tanto com o coração e o espírito. Acho que esse é o principal intuito da arte, é criar um manifesto emocional de forma única em cada ser. The Witcher 3 não é só possivelmente o maior jogo da história dos jogos, ele é possivelmente a maior obra artística que você poderá experienciar num mundo virtual in-game.   Se pegarmos todos os alicerces que compõem uma obra, como um filme perfeito do cinema, nós avaliaremos trilha sonora, fotografia, história/enredo, diálogos, personagens, figurino, som, intensidade, imersão, e assim por diante. Bom, você simplesmente encontrará tudo aqui neste jogo, num nível tão exorbitante e impecável que é até difícil de conceber como foi feito, planejado, pensado e executado. Conclui o jogo, esmiucei ele ao máximo, não só fazendo Quests secundárias, como tudo que é possível e chego num veredito final aqui.   The Witcher 3 é o melhor jogo da minha vida, é o jogo que vai te emocionar em todos os sentidos possíveis, vai te fazer chorar, rir, nutrir alegrias, inspirar, inclusive para sua própria vida pessoal. A experiência completa deste game fará você refletir e buscar por algo a mais na sua vida, viver uma grande história marcante cheia de aventuras e histórias maravilhosas. Tudo isso por míseros 20 reais, então para de comprar porcaria de jogo novo mal feito por 400 reais, e seja uma pessoa grata pelo resto da vida por encontrar meu comentário e ter vivido uma experiência única de vida (caso nunca tenha jogado). Se recomendo? Recomendo para pessoas que querem viver grandes histórias em suas vidas.  Trilha Sonora: 11/10  História/Enredo: 11/10  Personagens: 11/10  Fotografia: 11/10  Cinematografia: 11/10  Diálogos: 11/10  Figurino & Estilo histórico: 11/10  Som: 11/10  Design: 11/10  Jogabilidade: 11/10 Intensidade: 11/10  Imersão: 11/10  Magia Emocional: 100/10   Perfeição ÉPICA!","I will leave this analysis completely spontaneously and from the foundation of the soul. Many games have influenced me and made me fall in love with them since childhood, but very few have moved my heart and spirit so much. I think this is the main purpose of art, it is to create an emotional manifest in a unique way in each being. The Witcher 3 is not only possibly the greatest game in gaming history, it is possibly the greatest masterpiece you will ever experience in an in-game virtual world.   If we take all the foundations that make up a work, like a perfect cinema movie, we will evaluate soundtrack, photography, story/plot, dialogues, characters, costumes, sound, intensity, immersion, and so on. Well, you'll simply find everything here in this game, at such an exorbitant and impeccable level that it's even difficult to conceive how it was made, planned, thought and executed. Conclude the game, scrutinize it to the fullest, not only doing secondary Quests, but everything possible and I reach a final verdict here.   The Witcher 3 is the best game in my life, it is the game that will move you in every possible way, it will make you cry, laugh, nurture joy, inspire, including for your own personal life. The complete experience of this game will make you reflect and look for something more in your life, live a great remarkable story full of adventures and wonderful stories. All this for a measly few of bucks, so stop buying crappy new poorly made game for expensive price, and be a grateful person for the rest of your life for finding my comment and having lived a once-in-a-lifetime experience (if you've never played). Do I recommend? I recommend it for people who want to live great stories in their lives.  Soundtrack: 11/10 Story/Plot: 11/10 Characters: 11/10 Photography: 11/10 Cinematography: 11/10 Dialogues: 11/10 Historical Costume & Style: 11/10 Sound: 11/10 Design: 11/10 Gameplay: 11/10 Intensity: 11/10 Immersion: 11/10 Emotional Magic: 100/10  EPIC perfection!   ----------------------------------------------------------------------------------------------------------------------------  Vou deixar esta análise de forma totalmente espontânea e do alicerce da alma. Muitos jogos me marcaram e me fizeram me apaixonar desde a infância, mas pouquíssimos mexeram tanto com o coração e o espírito. Acho que esse é o principal intuito da arte, é criar um manifesto emocional de forma única em cada ser. The Witcher 3 não é só possivelmente o maior jogo da história dos jogos, ele é possivelmente a maior obra artística que você poderá experienciar num mundo virtual in-game.   Se pegarmos todos os alicerces que compõem uma obra, como um filme perfeito do cinema, nós avaliaremos trilha sonora, fotografia, história/enredo, diálogos, personagens, figurino, som, intensidade, imersão, e assim por diante. Bom, você simplesmente encontrará tudo aqui neste jogo, num nível tão exorbitante e impecável que é até difícil de conceber como foi feito, planejado, pensado e executado. Conclui o jogo, esmiucei ele ao máximo, não só fazendo Quests secundárias, como tudo que é possível e chego num veredito final aqui.   The Witcher 3 é o melhor jogo da minha vida, é o jogo que vai te emocionar em todos os sentidos possíveis, vai te fazer chorar, rir, nutrir alegrias, inspirar, inclusive para sua própria vida pessoal. A experiência completa deste game fará você refletir e buscar por algo a mais na sua vida, viver uma grande história marcante cheia de aventuras e histórias maravilhosas. Tudo isso por míseros 20 reais, então para de comprar porcaria de jogo novo mal feito por 400 reais, e seja uma pessoa grata pelo resto da vida por encontrar meu comentário e ter vivido uma experiência única de vida (caso nunca tenha jogado). Se recomendo? Recomendo para pessoas que querem viver grandes histórias em suas vidas.  Trilha Sonora: 11/10  História/Enredo: 11/10  Personagens: 11/10  Fotografia: 11/10  Cinematografia: 11/10  Diálogos: 11/10  Figurino & Estilo histórico: 11/10  Som: 11/10  Design: 11/10  Jogabilidade: 11/10 Intensidade: 11/10  Imersão: 11/10  Magia Emocional: 100/10   Perfeição ÉPICA!","I will leave this analysis completely spontaneously and from the foundation of the soul. Many games have influenced me and made me fall in love with them since childhood, but very few have moved my heart and spirit so much. I think this is the main purpose of art, it is to create an emotional manifest in a unique way in each being. The Witcher 3 is not only possibly the greatest game in gaming history, it is possibly the greatest masterpiece you will ever experience in an in-game virtual world.   If we take all the foundations that make up a work, like a perfect cinema movie, we will evaluate soundtrack, photography, story/plot, dialogues, characters, costumes, sound, intensity, immersion, and so on. Well, you'll simply find everything here in this game, at such an exorbitant and impeccable level that it's even difficult to conceive how it was made, planned, thought and executed. Conclude the game, scrutinize it to the fullest, not only doing secondary Quests, but everything possible and I reach a final verdict here.   The Witcher 3 is the best game in my life, it is the game that will move you in every possible way, it will make you cry, laugh, nurture joy, inspire, including for your own personal life. The complete experience of this game will make you reflect and look for something more in your life, live a great remarkable story full of adventures and wonderful stories. All this for a measly few of bucks, so stop buying crappy new poorly made game for expensive price, and be a grateful person for the rest of your life for finding my comment and having lived a once-in-a-lifetime experience (if you've never played). Do I recommend? I recommend it for people who want to live great stories in their lives.  Soundtrack: 11/10 Story/Plot: 11/10 Characters: 11/10 Photography: 11/10 Cinematography: 11/10 Dialogues: 11/10 Historical Costume & Style: 11/10 Sound: 11/10 Design: 11/10 Gameplay: 11/10 Intensity: 11/10 Immersion: 11/10 Emotional Magic: 100/10  EPIC perfection!   ----------------------------------------------------------------------------------------------------------------------------  Vou deixar esta anlise de forma totalmente espontnea e do alicerce da alma. Muitos jogos me marcaram e me fizeram me apaixonar desde a infncia, mas pouqussimos mexeram tanto com o corao e o esprito. Acho que esse  o principal intuito da arte,  criar um manifesto emocional de forma nica em cada ser. The Witcher 3 no  s possivelmente o maior jogo da histria dos jogos, ele  possivelmente a maior obra artstica que voc poder experienciar num mundo virtual in-game.   Se pegarmos todos os alicerces que compem uma obra, como um filme perfeito do cinema, ns avaliaremos trilha sonora, fotografia, histria/enredo, dilogos, personagens, figurino, som, intensidade, imerso, e assim por diante. Bom, voc simplesmente encontrar tudo aqui neste jogo, num nvel to exorbitante e impecvel que  at difcil de conceber como foi feito, planejado, pensado e executado. Conclui o jogo, esmiucei ele ao mximo, no s fazendo Quests secundrias, como tudo que  possvel e chego num veredito final aqui.   The Witcher 3  o melhor jogo da minha vida,  o jogo que vai te emocionar em todos os sentidos possveis, vai te fazer chorar, rir, nutrir alegrias, inspirar, inclusive para sua prpria vida pessoal. A experincia completa deste game far voc refletir e buscar por algo a mais na sua vida, viver uma grande histria marcante cheia de aventuras e histrias maravilhosas. Tudo isso por mseros 20 reais, ento para de comprar porcaria de jogo novo mal feito por 400 reais, e seja uma pessoa grata pelo resto da vida por encontrar meu comentrio e ter vivido uma experincia nica de vida (caso nunca tenha jogado). Se recomendo? Recomendo para pessoas que querem viver grandes histrias em suas vidas.  Trilha Sonora: 11/10  Histria/Enredo: 11/10  Personagens: 11/10  Fotografia: 11/10  Cinematografia: 11/10  Dilogos: 11/10  Figurino & Estilo histrico: 11/10  Som: 11/10  Design: 11/10  Jogabilidade: 11/10 Intensidade: 11/10  Imerso: 11/10  Magia Emocional: 100/10   Perfeio PICA!"
38577394,brazilian,"G E R A L D Ã O  T------- Treinado desde a infância e modificados para ganhar habilidades, força e reflexos sobre-humanos, bruxos são contrapesos vistos com desconfiança no mundo infestado de monstros no qual vivem; H------- História explendida, magnifica, 10/10; E------- Explore ruínas esquecidas, cavernas e naufrágios, negocie com vendedores e ferreiros em cidades e cace pelas planícies abertas, montanhas e mares;  W--------- WITCHER 3 GOTY PARA SEMPRE; I----------- Inspirada nos mitos eslavos e arquétipos dramáticos universais; T----------- Totalmente feito para a NOVA geração; C----------- Complexidade, profundidade do mundo; H----------- Honra de ser um bruxo; E----------- Extremamente divertido; R----------- RPG DE MUNDO ABERTO, cheio de escolhas importantes e consequências de impacto;  3----------- +3x que vou jogar ainda.   ","G E R A L D Ã T------- Trained from childhood and modified to gain superhuman skills, strength and reflexes, witches are a distrustful counterweight in the monster-infested world they live in; H------- Explored, magnificent history, 10/10; E------- Explore forgotten ruins, caves and shipwrecks, negotiate with vendors and blacksmiths in cities and hunt through open plains, mountains and seas; W-----WITCHER 3TY FOR EVER GORE; I----------- Inspired by Slavic myths and universal dramatic artifacts; T------- Totally made for the NEW generation; C-------Complexity, H-----WORLD; AB---WORLD; I'm going to be an EXTREME; R-------WORLD; R-------WORLD; R-------WORLD; R-------WORLD; R----WORLD; R----WORLD; R----WORLD; R----WORLD; R----WORLD; R----WORLD; R----WORLD; R----","G E R A L D  T------- Trained from childhood and modified to gain superhuman skills, strength and reflexes, witches are a distrustful counterweight in the monster-infested world they live in; H------- Explored, magnificent history, 10/10; E------- Explore forgotten ruins, caves and shipwrecks, negotiate with vendors and blacksmiths in cities and hunt through open plains, mountains and seas; W-----WITCHER 3TY FOR EVER GORE; I----------- Inspired by Slavic myths and universal dramatic artifacts; T------- Totally made for the NEW generation; C-------Complexity, H-----WORLD; AB---WORLD; I'm going to be an EXTREME; R-------WORLD; R-------WORLD; R-------WORLD; R-------WORLD; R----WORLD; R----WORLD; R----WORLD; R----WORLD; R----WORLD; R----WORLD; R----WORLD; R----"
